{
  "spec_version": "0.1.0",
  "construct_id": "art-shape-synthetic-00",
  "designer": {
    "agent": "fixture",
    "human": "wetware"
  },
  "chassis": "none",
  "intended_function": "reverse_transcriptase",
  "intended_bsl": "BSL-1",
  "not_for_synthesis": true,
  "fragments": [
    {
      "id": "array1",
      "role": "repeat_array",
      "alphabet": "dna",
      "sequence": "ACGTACGTACGTACGTACGTACGTACGTACGTACGTACGTACGTACGTACGTACGTACGTACGTACGTACGTACGTACGTACGTACGTACGTACGTACGTACGTACGTACGTACGTACGTACGTACGTACGTACGTACGTACGT"
    },
    {
      "id": "cds_rt",
      "role": "cds",
      "alphabet": "dna",
      "sequence": "ATGAAACCCGGGTTTATGAAACCCGGGTTT"
    }
  ]
}
